{"authorization":{"authorization_token":"sha256:38722c9e4b69eaca82ef1cee292c759ac5d3e35992174f078676ec161281c14f","path":"evals/m4/authorization/m4.2/execution-authorization.json","raw_sha256":"dc73c9376bdd78cf7e0d355701c8c3fe6966c34db5a1203544b9d95ab88e719b"},"batch_order":["M4.2-BATCH-NUC","M4.2-BATCH-MEC","M4.2-BATCH-ELE","M4.2-BATCH-AUT","M4.2-BATCH-COM","M4.2-BATCH-MPH"],"batches":[{"batch_id":"M4.2-BATCH-NUC","domain":"nuclear_engineering","later_batches_mutable_after_observation":false,"planned_task_count":10,"source_batch_id":"M4.1-BATCH-NUC","stop_on_infrastructure_or_protocol_failure":true,"task_ids":["M4.2-NUC-A-F","M4.2-NUC-B-A1","M4.2-NUC-A-A1","M4.2-NUC-B-A3","M4.2-NUC-A-A2","M4.2-NUC-B-F","M4.2-NUC-A-N","M4.2-NUC-B-A2","M4.2-NUC-A-A3","M4.2-NUC-B-N"]},{"batch_id":"M4.2-BATCH-MEC","domain":"mechanical_engineering","later_batches_mutable_after_observation":false,"planned_task_count":10,"source_batch_id":"M4.1-BATCH-MEC","stop_on_infrastructure_or_protocol_failure":true,"task_ids":["M4.2-MEC-A-N","M4.2-MEC-A-A1","M4.2-MEC-B-F","M4.2-MEC-A-A3","M4.2-MEC-B-A3","M4.2-MEC-B-A1","M4.2-MEC-B-A2","M4.2-MEC-A-A2","M4.2-MEC-A-F","M4.2-MEC-B-N"]},{"batch_id":"M4.2-BATCH-ELE","domain":"electrical_engineering","later_batches_mutable_after_observation":false,"planned_task_count":10,"source_batch_id":"M4.1-BATCH-ELE","stop_on_infrastructure_or_protocol_failure":true,"task_ids":["M4.2-ELE-B-A2","M4.2-ELE-B-A1","M4.2-ELE-A-A1","M4.2-ELE-A-N","M4.2-ELE-A-F","M4.2-ELE-B-A3","M4.2-ELE-B-N","M4.2-ELE-B-F","M4.2-ELE-A-A3","M4.2-ELE-A-A2"]},{"batch_id":"M4.2-BATCH-AUT","domain":"automation_control","later_batches_mutable_after_observation":false,"planned_task_count":10,"source_batch_id":"M4.1-BATCH-AUT","stop_on_infrastructure_or_protocol_failure":true,"task_ids":["M4.2-AUT-B-A2","M4.2-AUT-B-A3","M4.2-AUT-A-A3","M4.2-AUT-B-A1","M4.2-AUT-A-A1","M4.2-AUT-B-N","M4.2-AUT-A-A2","M4.2-AUT-B-F","M4.2-AUT-A-N","M4.2-AUT-A-F"]},{"batch_id":"M4.2-BATCH-COM","domain":"computer_data","later_batches_mutable_after_observation":false,"planned_task_count":10,"source_batch_id":"M4.1-BATCH-COM","stop_on_infrastructure_or_protocol_failure":true,"task_ids":["M4.2-COM-B-F","M4.2-COM-B-A1","M4.2-COM-B-A2","M4.2-COM-A-N","M4.2-COM-B-N","M4.2-COM-A-A3","M4.2-COM-B-A3","M4.2-COM-A-A2","M4.2-COM-A-F","M4.2-COM-A-A1"]},{"batch_id":"M4.2-BATCH-MPH","domain":"multiphysics","later_batches_mutable_after_observation":false,"planned_task_count":10,"source_batch_id":"M4.1-BATCH-MPH","stop_on_infrastructure_or_protocol_failure":true,"task_ids":["M4.2-MPH-B-F","M4.2-MPH-A-N","M4.2-MPH-A-A2","M4.2-MPH-A-A1","M4.2-MPH-A-A3","M4.2-MPH-B-A2","M4.2-MPH-A-F","M4.2-MPH-B-N","M4.2-MPH-B-A1","M4.2-MPH-B-A3"]}],"does_not_authorize":["a launch claim or consumption of this authorization","a second claim or a partial-matrix claim","a second attempt, retry, repair, continuation, or follow-up message","a task outside the frozen 60-task M4.2 matrix","cross-task or cross-arm result visibility","judge execution, blind-map access, or unblinding","result aggregation or acceptance-threshold claims","changes to cases, prompts, variants, rubric, thresholds, or randomization","M4 closure, M5, an experiment, simulation, training run, deployment, or control action"],"execution_constraints":{"attempts_per_task_id":1,"exact_model_id":"gpt-5.6-sol","partial_authority_allowed":false,"reasoning_effort":"max","second_claim_allowed":false,"successor_revision_required_after_failure":true,"whole_matrix_required":true},"execution_helper":{"git_blob_oid":"27e3e11d5790f28e32fee87693a5f88ef77b6bb7","minimum_windows_powershell_version":"5.1","path":"evals/m4/execution/prepare_m4_2_request_bundles.ps1","raw_sha256":"40b15ec3d1ce885f5f0d438377e298541974d46eb26efc934c0755b22b126712","read_only":true,"request_binding_count":60},"launch_claim":{"claim_consumes_authorization_token":true,"claim_consumes_entire_matrix_authorization":true,"claim_count_before_execution":0,"must_be_absent_before_execution":true,"must_be_created_before_first_task":true,"partial_authority_allowed":false,"path":"evals/m4/execution/m4.2/launch-claim.json","second_claim_allowed":false,"successor_revision_required_after_failure":true},"milestone":"M4","permissions":{"aggregation":false,"blind_mapping_access":false,"cross_task_result_read":false,"followup_message":false,"fresh_task_creation":true,"judge_execution":false,"m4_closure":false,"repair":false,"result_writes_below_frozen_roots":true,"retry":false,"threshold_claim":false},"prelaunch_counters":{"acceptance_claims":0,"aggregation_calls":0,"authorized_tasks":0,"created_contexts":0,"dispatched_tasks":0,"finalizations":0,"judge_scores":0,"raw_model_finals":0,"repairs":0,"results_observed":0,"retries":0,"unauthorized_side_effects":0},"preparation":{"accepted_candidate_head":"44e6cd611ce67f362015c431d3c1d6ba069ad345","git_blob_oid":"fe768c25100e6750ece90159d6b88109356cdf6e","path":"evals/m4/authorization/m4.2/authorization-preparation.json","raw_sha256":"573ee113c5846ace7892607f953e2bd83985a104a43d268cc63b7a7425c5950d","request_binding_count":60},"request_policy":{"cross_task_result_visibility":false,"environment_type":"worktree","one_independent_finalization_per_task_id":true,"one_new_thread_per_task_id":true,"project_id":"ff35b25f-4644-41c8-9073-74c697559439","starting_branch":"codex/m4-cross-engineering-forward-evaluation-m4.2-one-shot-authorization","surface":"codex_app.create_thread","target_type":"project"},"revision":"M4.2","schema_version":"m4.2-execution-control-v1","status":"READY_UNCONSUMED","tasks":[{"allowed_context_paths":["evals/m4/cases/electrical-b.json","evals/m4/task-protocol.md","evals/m4/variants/A2/instructions.md"],"attempt_limit":1,"batch_id":"M4.2-BATCH-ELE","blind_id":"M4-J121","case_path":"evals/m4/cases/electrical-b.json","cross_task_result_visibility":false,"forbidden_context_roots":["evals/m4/results","evals/m4/execution"],"independent_finalization_required":true,"request_binding_sha256":"a3c1cfb8e3c08eee5dd558afe372e1a78a2df539fcbda0b6a9dc65661fad732f","result_root":"evals/m4/results/m4.2/M4.2-ELE-B-A2","result_root_must_be_absent":true,"root_task_id":"M4-ELE-B-A2","source_task_id":"M4.1-ELE-B-A2","task_id":"M4.2-ELE-B-A2","task_protocol_path":"evals/m4/task-protocol.md","variant_instruction_path":"evals/m4/variants/A2/instructions.md"},{"allowed_context_paths":["evals/m4/cases/electrical-b.json","evals/m4/task-protocol.md","evals/m4/variants/A1/instructions.md"],"attempt_limit":1,"batch_id":"M4.2-BATCH-ELE","blind_id":"M4-J122","case_path":"evals/m4/cases/electrical-b.json","cross_task_result_visibility":false,"forbidden_context_roots":["evals/m4/results","evals/m4/execution"],"independent_finalization_required":true,"request_binding_sha256":"d14f0cffea07d8bc8a162f870015978dd6a6171d683aa4983358abc44b908aa2","result_root":"evals/m4/results/m4.2/M4.2-ELE-B-A1","result_root_must_be_absent":true,"root_task_id":"M4-ELE-B-A1","source_task_id":"M4.1-ELE-B-A1","task_id":"M4.2-ELE-B-A1","task_protocol_path":"evals/m4/task-protocol.md","variant_instruction_path":"evals/m4/variants/A1/instructions.md"},{"allowed_context_paths":["evals/m4/cases/mechanical-a.json","evals/m4/task-protocol.md"],"attempt_limit":1,"batch_id":"M4.2-BATCH-MEC","blind_id":"M4-J123","case_path":"evals/m4/cases/mechanical-a.json","cross_task_result_visibility":false,"forbidden_context_roots":["evals/m4/results","evals/m4/execution"],"independent_finalization_required":true,"request_binding_sha256":"551a9096414c9722b77b3e0bef3bf54253ae95114146740d781fde6683d204fa","result_root":"evals/m4/results/m4.2/M4.2-MEC-A-N","result_root_must_be_absent":true,"root_task_id":"M4-MEC-A-N","source_task_id":"M4.1-MEC-A-N","task_id":"M4.2-MEC-A-N","task_protocol_path":"evals/m4/task-protocol.md","variant_instruction_path":null},{"allowed_context_paths":["evals/m4/cases/nuclear-a.json","evals/m4/task-protocol.md","evals/m4/variants/F/instructions.md"],"attempt_limit":1,"batch_id":"M4.2-BATCH-NUC","blind_id":"M4-J124","case_path":"evals/m4/cases/nuclear-a.json","cross_task_result_visibility":false,"forbidden_context_roots":["evals/m4/results","evals/m4/execution"],"independent_finalization_required":true,"request_binding_sha256":"b05f0b338f176a505647a0391770598b60e6070cfae113aeaa6b85c953f28165","result_root":"evals/m4/results/m4.2/M4.2-NUC-A-F","result_root_must_be_absent":true,"root_task_id":"M4-NUC-A-F","source_task_id":"M4.1-NUC-A-F","task_id":"M4.2-NUC-A-F","task_protocol_path":"evals/m4/task-protocol.md","variant_instruction_path":"evals/m4/variants/F/instructions.md"},{"allowed_context_paths":["evals/m4/cases/nuclear-b.json","evals/m4/task-protocol.md","evals/m4/variants/A1/instructions.md"],"attempt_limit":1,"batch_id":"M4.2-BATCH-NUC","blind_id":"M4-J125","case_path":"evals/m4/cases/nuclear-b.json","cross_task_result_visibility":false,"forbidden_context_roots":["evals/m4/results","evals/m4/execution"],"independent_finalization_required":true,"request_binding_sha256":"2e799141d38dc3cd5146158486ba08b7158427d91ef664efdadd72bc99afc1f0","result_root":"evals/m4/results/m4.2/M4.2-NUC-B-A1","result_root_must_be_absent":true,"root_task_id":"M4-NUC-B-A1","source_task_id":"M4.1-NUC-B-A1","task_id":"M4.2-NUC-B-A1","task_protocol_path":"evals/m4/task-protocol.md","variant_instruction_path":"evals/m4/variants/A1/instructions.md"},{"allowed_context_paths":["evals/m4/cases/multiphysics-b.json","evals/m4/task-protocol.md","evals/m4/variants/F/instructions.md"],"attempt_limit":1,"batch_id":"M4.2-BATCH-MPH","blind_id":"M4-J126","case_path":"evals/m4/cases/multiphysics-b.json","cross_task_result_visibility":false,"forbidden_context_roots":["evals/m4/results","evals/m4/execution"],"independent_finalization_required":true,"request_binding_sha256":"00c4bba91591f78e7f1121ed01860780f6e2a455fca226d52977d5a874bee9c7","result_root":"evals/m4/results/m4.2/M4.2-MPH-B-F","result_root_must_be_absent":true,"root_task_id":"M4-MPH-B-F","source_task_id":"M4.1-MPH-B-F","task_id":"M4.2-MPH-B-F","task_protocol_path":"evals/m4/task-p